url,extracted_text,sentiment,entities,detailed_category
https://oklahoma.gov/elections.html,"Established under the Constitution of the State of Oklahoma in 1907, the Oklahoma State Election Board is the administrative agency for the conduct of state elections and the oversight of the state's 77 county election boards. Learn more about the State Election Board.","Sentiment score 0.0 , Sentiment Magnitude 0.0","name:Oklahoma State Election Board type: 3 Salience 0.42450156807899475, name:Constitution of the State of Oklahoma type: 5 Salience 0.17896075546741486, name:state elections type: 4 Salience 0.10077492147684097, name:county election boards type: 3 Salience 0.07187651097774506, name:state type: 2 Salience 0.036586739122867584","Category:/Law & Government/Government , Category_confidence:51.0%"
https://www.cnn.com/2025/08/20/business/companies-trump-free-market,"Donald Trump See all topics Follow

A version of this story appeared in CNN Business’ Nightcap newsletter. To get it in your inbox, sign up for free here.

Not long ago, American conservative orthodoxy held that when it comes to doing business, the government that governs least governs best.

The orthodoxy manifested itself in familiar ways. Groups that claimed the mantle of individual liberties would decry new legislation. Talk radio and podcasts would mock unnamed bureaucrats for ham-fisted overreach. And powerful business lobbies were quick to denounce — in press releases and even lawsuits — regulations or taxes they saw as government overreach.

But when faced with President Donald Trump’s efforts to seize control of private enterprise — such as his recent arrangement to have the US pocket a portion of Nvidia’s sales to China, his social media outbursts at individual executives, his moves to take a stake in Intel, and his use of executive powers to cajole banks and law firms he perceives as insufficiently loyal — those same groups have gone quiet.

Take the US Chamber of Commerce, the largest business advocacy group in the country.

Last year, the Chamber sued a federal consumer watchdog group for attempting to cap credit card late fees at $8 a month, claiming the agency “exceeded its statutory authority.” In 2023, it sued the Biden administration over provisions for Medicare price negotiations in the Inflation Reduction Act, claiming the move would consolidate “unfettered and unchecked power” to the department of Health and Human Services.

But under Trump’s second term, the Chamber has had little to say publicly about Trump’s aggressive meddling in the private sector.

US chipmaker Nvidia recently agreed to give the US government a 15% cut of its sales to China. VCG/AP/File

Similarly, the Business Roundtable, another DC-based lobbying group that represents hundreds of chief executives, has rarely been shy about denouncing what it sees as presidential overreach in the form of taxes and environmental regulations. This year, though, the group has been largely MIA on the MAGA shift toward a style of capitalism that more closely resembles the autocratic regimes of Russia and China.

Both groups have criticized Trump’s trade war, warning that tariffs hurt American businesses. But neither has spoken out about the president’s more direct assault on free enterprise.

Neither the Chamber of Commerce nor the Business Roundtable responded to multiple requests for comment.

The ‘Eye of Sauron’ factor

The president, a self-styled dealmaker, has thrown out the standard free-market playbook in ways that have alarmed lawmakers, investors and legal experts. And suddenly, the legal protections businesses have long counted on appear shaky, said Philip M. Nichols, a professor of legal studies and business ethics at the University of Pennsylvania’s Wharton School.

“Any business that sticks its head up, or any business person that sticks their head up, is taking a risk that can’t be calculated,” Nichols said in an interview. “What’s the smart thing to do — what do the wildebeest do when they get to the crocodile-infected river? They wait for the other wildebeest to jump in, and then follow.”

Several trade groups have privately drafted plans to push back against the Trump administration in defense of their business interests, people familiar with the matter told CNN. But those plans were shelved at the request of members that are worried about drawing White House ire.

“There’s an ‘Eye of Sauron’ element here that everyone is very aware of,” one manufacturing CEO told CNN, referring to the “Lord of the Rings” character that brought all subjects to heel. “But there’s also a recognition that this is an administration that is transactional if they believe you’re on board with their agenda.”

When it comes to exerting his influence over Corporate America, no matter appears too small or too large for Trump’s input.

Last month, the president took credit for Coca-Cola’s decision to roll out a cane-sugar-sweetened product that aligns with his allies’ “Make America Healthy Again” philosophy. He regularly criticizes CEOs in public for perceived slights, demanded that Intel’s boss resign over unspecified conflicts, and urged Goldman Sachs to fire its top economist after the bank said tariffs would raise consumer prices (a fact virtually all economists agree to be true, and which we are now seeing borne out in reality).

While much of that bluster is run-of-the-mill Trump rhetoric, the president shocked trade experts when he announced an unorthodox (and potentially illegal) arrangement with chipmakers Nvidia and AMD earlier this month. In exchange for export licenses that allow them to sell their products in China, the companies agreed to funnel 15% of their China sales to the US government — a setup that some analysts called a “shakedown” of private enterprise.

The White House’s push into private businesses took another turn Tuesday when officials confirmed the administration was considering using taxpayer money to acquire a stake in struggling chipmaker Intel. The primary reason for such a move, Commerce Secretary Howard Lutnick said, was the president’s desire to reduce US dependence on Taiwan for chip production. But he also said Trump believes the government should have “equity” in tech giants.

Risk calculus

The silence from Corporate America to Trump’s incursion into private businesses isn’t entirely unexpected. Businesses have lost their appetite for the kind of socially progressive rhetoric many adopted in response to the 2020 murder of George Floyd. At the same time, Trump’s return to the White House came with a cost-benefit analysis for any business leaders thinking of speaking out: Make yourself a target, or fall in line and wait for the massive tax cuts the president has promised.

“Corporate citizens are harmed just like flesh and blood citizens are harmed when you have a leader who… actively seeks to monetize public office and actively seeks to use the power of the presidency to harm perceived enemies or anyone who doesn’t appropriately capitulate,” Donald Sherman, executive director of the Center for Responsibility and Ethics in Washington, told CNN. “In some ways, this is the natural and predictable result of failing to appropriately stand up to President Trump’s anti-democratic and authoritarian tendencies during his first term.”","Sentiment score -0.30000001192092896 , Sentiment Magnitude 19.899999618530273","name:Donald Trump type: 1 Salience 0.13418550789356232, name:Nvidia type: 3 Salience 0.06492521613836288, name:Business Roundtable type: 3 Salience 0.029421547427773476, name:Groups type: 3 Salience 0.02857922948896885, name:Chamber of Commerce type: 3 Salience 0.027825605124235153, name:government type: 3 Salience 0.02404283545911312, name:Intel type: 3 Salience 0.01895139552652836, name:press releases type: 5 Salience 0.016802143305540085, name:China type: 2 Salience 0.01194569282233715, name:president type: 1 Salience 0.010736544616520405, name:administration type: 3 Salience 0.008093610405921936, name:businesses type: 3 Salience 0.007784033659845591, name:newsletter type: 5 Salience 0.0067054047249257565, name:story type: 5 Salience 0.0067054047249257565, name:version type: 5 Salience 0.0067054047249257565, name:legislation type: 5 Salience 0.006615441758185625, name:mantle type: 2 Salience 0.006615441758185625, name:podcasts type: 5 Salience 0.006602915469557047, name:bureaucrats type: 1 Salience 0.006602915469557047, name:companies type: 3 Salience 0.006508458871394396","Category:/News/Politics , Category_confidence:73.0%"
https://www.colliercountyfl.gov/government/county-manager-operations/divisions/communications-government-public-affairs,Failed to fetch page: 403,Failed to fetch page: 403,Failed to fetch page: 403,Failed to fetch page: 403
https://www.stimson.org/2025/myanmars-december-election-engineering-continuity-through-institutional-redesign/,Content too short or access restricted,Content too short or access restricted,Content too short or access restricted,Content too short or access restricted
https://www.deloitte.com/us/en/insights/topics/economy/global-economic-outlook/weekly-update.html,"Tariffs and their potential impact

The effective average tariff rate imposed by the United States is now roughly 18%, according to calculations made by the Yale Budget Lab. This is the highest tariff rate since the early 1930s. Moreover, it is 15 percentage points higher than at the start of the year. Recall that, in 1930, the US Congress enacted the Smoot Hawley Tariff Act, which increased the average tariff rate by 6.5 percentage points. It led to retaliation by other countries. The result was that it greatly exacerbated the Great Depression, including a massive reduction in global trade.

In this case, there has not yet been substantial retaliation, but the increase in prices and the commensurate reduction in purchasing power will likely have a negative impact on US growth. The Yale Budget Lab estimates that real GDP growth in 2026 will be 1 percentage point below the baseline forecast and, in the years to come, annual growth will be 0.5 percentage points below the baseline. This assumes that the current tariff rates remain in place. The reduction in growth will likely be driven by weakness in both manufacturing and construction. Although durable goods manufacturing is expected to improve, other areas of manufacturing may worsen, especially advanced manufacturing.

Leaving aside the Yale Budget Lab forecasts, the reality is that an 18% tariff applied to last year’s US$3.3 trillion in imports implies roughly US$600 billion in additional annual government revenue, or about 2.1% of GDP. Think of that as an annual tax increase of 2.1% of GDP, more than offsetting the impact of the tax cuts in the bill recently passed by the US Congress. All other things being equal, that will likely have a sharp negative impact on real GDP growth. Moreover, even if the tariffs are not fully passed onto consumers, then businesses will see a sharp decline in profits. Either way, there could be a negative economic impact.

On the other hand, such a large increase in the prices of imported goods would likely lead to a decline in the volume of imports, thereby reducing the net impact on GDP. If there is a substantial decline in the volume of imports, that will be a negative shock to the exports of other countries. Moreover, if businesses begin to see the new level of tariffs as permanent, it will likely lead to a redesign of supply chains as well as significant shifts in global trade patterns.

Finally, one might argue that, given the large US budget deficit, a tax increase might be welcome. Yet the challenge with tariffs as a source of revenue is that they have different impacts on different industries, shift production toward lower value-added processes, hurt business investment, exacerbate income inequality, and could ultimately damage productivity and growth.

Meanwhile, there continues to be debate about the potential inflationary effect of tariffs. Many analysts have noted the lack of significant US inflation so far this year. Some analysts have suggested that there won’t be significant inflation. They point to foreign exporters taking a hit to margins by lowering export prices. They also point to domestic sellers also taking a hit to margins by not fully passing on tariffs to their customers.

This is all true. However, it is likely that these companies attempted to maintain market share on the expectation that tariffs would be temporary. They evidently believed that the tariffs imposed by the United States were meant to compel changed behavior by other countries, after which tariffs would be reduced. Yet that is not what has happened. Instead, the United States has compelled other countries to make certain commitments. In exchange, the United States has agreed to not impose steep tariffs but has left in place historically high tariffs. My expectation is, once companies recognize the permanence of tariffs, they will raise prices accordingly.

Indeed, one large consumer products company announced that, in the coming year, it will boost US prices by 5% to offset the US$1 billion impact of tariffs. Also, investors evidently expect tariffs to boost inflation. The five-year breakeven rate, which is a measure of bond investor expectations of average inflation over the coming five years, has lately increased by about 20 basis points as the final level of tariffs become clear. The breakeven rate had declined after the April tariff announcements as investors worried about a recession that would weaken inflation. Yet now, investors are not changing their view about growth, only their view about inflation.

On the other hand, many investors evidently believe that tariffs will weaken growth and that the boost to inflation will be relatively short-lived. As such, the futures markets indicate that investors expect the Federal Reserve to cut the benchmark interest rate two to three times before the end of this year.

Meanwhile, the US government released monthly data on personal income, consumer expenditures, and the Federal Reserve’s favorite measure of inflation, which is the personal consumption expenditures deflator, or PCE-deflator. This measure of inflation accelerated modestly in June, with prices up 2.7% from a year earlier and up 0.3% from the previous month.

However, the most notable part of the report concerns prices of durable goods, many of which are imported. The PCE-deflator for durables increased 0.5% in both April and June versus the previous month. This was the biggest gain since mid-2022. In addition, the PCE-deflator for durables was up 0.9% from a year earlier in June, the biggest gain since December 2022. Normally, prices of durables decline. Plus, the government also reported that the real volume of durable goods purchased by consumers fell sharply.

This is early evidence of the impact of tariffs. Moreover, these increases do not yet fully reflect the impact of tariffs as businesses have cut prices to partly offset tariffs. The result has been weakened profits. This will not likely continue, especially as it is now clear that high tariffs are here to stay. Thus, expect inflation to accelerate in the months to come. The Yale Budget Lab estimates that, if businesses fully pass through the impact of tariffs, inflation will nearly double in the coming 12 months.","Sentiment score -0.30000001192092896 , Sentiment Magnitude 24.100000381469727","name:US Congress type: 3 Salience 0.04923025518655777, name:investors type: 1 Salience 0.021642573177814484, name:United States type: 2 Salience 0.018488235771656036, name:Yale Budget Lab type: 3 Salience 0.014261127449572086, name:analysts type: 1 Salience 0.011130167171359062, name:countries type: 3 Salience 0.009877344593405724, name:retaliation type: 4 Salience 0.008390898816287518, name:Federal Reserve type: 3 Salience 0.007835578173398972, name:gain type: 4 Salience 0.006973183248192072, name:reduction type: 4 Salience 0.0061206030659377575, name:sellers type: 1 Salience 0.006032452452927828, name:growth type: 4 Salience 0.005535910837352276, name:Smoot Hawley Tariff Act type: 5 Salience 0.004368710797280073, name:consumer products company type: 3 Salience 0.0029110678005963564, name:consumers type: 1 Salience 0.00277605839073658, name:areas type: 2 Salience 0.002766367746517062, name:businesses type: 3 Salience 0.0026352060958743095, name:hit type: 5 Salience 0.0024692800361663103, name:exporters type: 1 Salience 0.0023356517776846886, name:companies type: 3 Salience 0.0022994745522737503","Category:/Business & Industrial , Category_confidence:85.0%"
https://www.investopedia.com/5-things-to-know-before-the-stock-market-opens-august-22-2025-11795747,"U.S. stock futures are slightly higher as investors await Federal Reserve Chair Jerome Powell's speech today, which could lay out expectations for interest-rate cuts; Nvidia (NVDA) reportedly has told suppliers to halt production on its H20 AI chip as China raises security concerns; Meta Platforms (META) reportedly inks a $10 billion-plus contract with Alphabet's (GOOGL) Google for cloud services as it continues to build out AI infrastructure; and shares of TurboTax parent Intuit (INTU) are dropping on soft profit and revenue projections. Here's what investors need to know today.

1. US Stock Futures Point Higher Ahead of Key Federal Reserve Speech

U.S. stock futures are pointing higher as investors await remarks this morning from Federal Reserve Chair Jerome Powell that could set expectations on future interest-rate cuts. Dow Jones Industrial Average futures are higher by 0.3% in early trading after declining by a similar percentage Thursday. S&P 500 and Nasdaq futures also are slightly higher after the indexes posted losses yesterday, with the S&P falling for a fifth straight session. Bitcoin (BTCUSD) is ticking higher. The yield on the 10-year Treasury note is little changed. Oil futures are moving higher. Gold futures are declining.

2. Fed Chair Powell Set to Give Highly Anticipated Speech Today

Fed Chair Jerome Powell's highly anticipated speech at 10 a.m. ET is expected to provide insight into the central bank's interest-rate plans, which could create a markets reaction. Powell's speech at the annual Jackson Hole Economic Symposium comes as the Fed faces elevated inflation rates and signals of labor market weakening. President Donald Trump is putting pressure on the Fed to cut interest rates, while Powell has expressed caution as the central bank monitors tariffs impacts.

3. Nvidia Halts China Chip Production as Beijing Warns Over Security, Reports Say

Nvidia (NVDA) reportedly has told suppliers to suspend production of its H20 semiconductor, after Beijing asked local firms to avoid using the chip intended for the Chinese market due to security concerns. The Information reported that Nvidia instructed Samsung Electronics and Amkor Technology to halt production of the H20 chip, while Reuters said that the firm asked Foxconn to suspend work on them. The H20 was recently approved for sale to China by the Trump administration on the condition that 15% of the chip's Chinese revenue be paid to the U.S. government. Nvidia shares are 1% lower in premarket trading.

4. Meta Inks Google Cloud Services Deal Worth at Least $10B, Report Says

Meta Platforms (META) will spend $10 billion on cloud services from its Google parent Alphabet (GOOGL), according to a report in The Information. Meta also has contracted with Microsoft Azure and Amazon Web Services for cloud infrastructure, while Google recently inked a similar deal with OpenAI. Shares of Alphabet are up more than 1%, while Meta shares are ticking higher.

5. Intuit Stock Drops on Weak Revenue, Profit Outlook

Intuit (INTU) shares are sinking 6.5% in premarket trading after the tax software maker issued softer-than-expected profit and revenue projections. Intuit reported fiscal 2025 fourth-quarter adjusted earnings per share of $2.75 on revenue that jumped 20% to $3.83 billion, with both beating consensus estimates of analysts polled by Visible Alpha. However, the TurboTax parent also projected current-quarter revenue growth of 14% to 15%, lower than the 16.2% expected by analysts, and its EPS projections for fiscal 2026 first quarter and full year came in weaker than expected.","Sentiment score -0.10000000149011612 , Sentiment Magnitude 9.0","name:Nvidia type: 3 Salience 0.08375944197177887, name:Jerome Powell type: 1 Salience 0.06192399188876152, name:Intuit type: 3 Salience 0.05739753320813179, name:speech type: 4 Salience 0.05387066677212715, name:investors type: 1 Salience 0.01885247975587845, name:U.S. type: 2 Salience 0.01685846783220768, name:Google type: 3 Salience 0.014875376597046852, name:Federal Reserve type: 3 Salience 0.014615711756050587, name:INTU type: 3 Salience 0.01286211609840393, name:suppliers type: 3 Salience 0.012370302341878414, name:AI type: 3 Salience 0.010201950557529926, name:China type: 2 Salience 0.009066427126526833, name:TurboTax type: 6 Salience 0.008271822705864906, name:GOOGL type: 3 Salience 0.007975869812071323, name:parent type: 1 Salience 0.007167790085077286, name:Donald Trump type: 1 Salience 0.0062904381193220615, name:Meta Platforms type: 3 Salience 0.006086278706789017, name:NVDA type: 3 Salience 0.005653939209878445, name:Foxconn type: 3 Salience 0.00563398189842701, name:central bank type: 3 Salience 0.0053385780192911625","Category:/Finance/Investing , Category_confidence:75.0%"
https://www.politico.com/news/2025/08/19/trump-and-putin-are-both-criticizing-mail-in-voting-election-officials-are-freaking-out-00515513,Failed to fetch page: 403,Failed to fetch page: 403,Failed to fetch page: 403,Failed to fetch page: 403
