url,extracted_text,sentiment,entities,detailed_category
https://www.reuters.com/technology/artificial-intelligence/ai-will-replace-most-humans-then-what-2025-08-19/,Failed to fetch page: 401,Failed to fetch page: 401,Failed to fetch page: 401,Failed to fetch page: 401
https://coloradonewsline.com/2025/08/20/reform-sweeping-ai-law-colorado/,Failed to fetch page: 403,Failed to fetch page: 403,Failed to fetch page: 403,Failed to fetch page: 403
https://diginomica.com/mit-artificial-intelligence-ai-report-fallout-if-ai-winter-coming-it-cant-arrive-soon-enough,Content too short or access restricted,Content too short or access restricted,Content too short or access restricted,Content too short or access restricted
https://www.reuters.com/world/us/americans-fear-ai-permanently-displacing-workers-reutersipsos-poll-finds-2025-08-19/,Failed to fetch page: 401,Failed to fetch page: 401,Failed to fetch page: 401,Failed to fetch page: 401
https://www.npr.org/sections/shots-health-news/2025/08/19/nx-s1-5506292/doctors-ai-artificial-intelligence-dependent-colonoscopy,"Research suggests doctors might quickly become dependent on AI

toggle caption Sorbetto/Getty Images

Artificial intelligence is beginning to help doctors screen patients for several routine diseases. But a new study raises concerns about whether doctors might become too reliant on AI.

The study looking at gastroenterologists in Poland found that they appeared to be about 20% worse at spotting polyps and other abnormalities during colonoscopies on their own, after they'd grown accustomed to using an AI-assisted system.

The findings, published in the journal Lancet Gastroenterology and Hepatology, suggest that even after a short period of using AI, experts may become overly dependent on AI to do certain aspects of their jobs.

""We were quite surprised,"" says Marcin Romańczyk, an M.D.-Ph.D. gastroenterologist at H-T Medical Center in Tychy, Poland, who led the study.

But not everyone is convinced that the paper proves doctors are losing critical skills because of AI.

Sponsor Message

""I think three months seems like a very short period to lose a skill that you took 26 years to build up,"" says Johan Hulleman, a researcher at Manchester University in England who has studied human reliance on artificial intelligence.

Hulleman believes statistical variations in the patient data might be part of the explanation for why the numbers appear to drop. Factors such as the average age of the patients used in different sections of the study might explain the variation, he says.

AI in medicine

Artificial intelligence is becoming increasingly common for a number of routine medical scans. The next time you get a scan for your eyes, breast cancer, or colon disease, there's a decent chance that AI might be analyzing the images.

""AI is spreading everywhere,"" Romańczyk says. At the same time, many doctors are playing catch-up, because learning how to use the technology wasn't part of their training.

""We've been taught from books and from our teachers,"" he says. ""No one told us how to use AI.""

A few years ago, four clinics in Poland tried out an AI system to detect polyps and other abnormalities during colonoscopies. The AI works in real time, analyzing video from a camera inside the colon.

If it spots something, it will highlight the area for the clinician to see.

""In this particular one there's a green box, showing where the polyp might be,"" he says.

In the box

The clinics were collecting data on whether the AI system worked. It turns out it did, but when Romańczyk and his colleagues reanalyzed the data, they found something else: After the system was introduced, doctors became significantly worse at detecting possible polyps when the AI was switched off.

According to their analysis, after doctors got AI, detection rates of possible polyps fell from 28.4% to 22.4% when their new AI system was switched off. In other words, the doctors seemed to become quickly dependent on AI systems catching the polyps. Romańczyk says he's not quite sure why it's happening, but he has some theories.

""We are subconsciously waiting for the green box to come out to show us the region where the polyp is and we're not paying so much attention,"" he says.

Sponsor Message

There are other examples that support that idea: A similar study has shown that nonexperts do a worse job scanning mammograms if they know they can get an AI system to help them with the push of a button.

Johan Hulleman, who helped lead that mammogram study, describes it as a ""safety-net effect."" He says these latest results could be interesting, but he's skeptical. The study of colonoscopies took place over three months, and the doctors participating had decades of experience. He thinks statistical variations due to a number of factors, such as age of the patients, might be behind the apparent drop.

Additionally, he says, ""We don't know how many polyps there really were, so we don't know the ground truth."" By that he means it's unclear how many of the possible polyps that doctors supposedly missed were actually medically important.

The study's author, Romańczyk, does believe the drop is real — though he admits that studying AI in a clinical setting like this can be tricky. There are a lot of variables the researchers couldn't control.

He's not against using AI. He actually thinks the little green boxes help him to do better colonoscopies. But he thinks that there should be more studies like these examining how AI might be changing the way doctors work in the real world.

""Because look what's happening,"" he says. ""We have AI systems that are available, but we don't have the data.""","Sentiment score -0.20000000298023224 , Sentiment Magnitude 14.399999618530273","name:Johan Hulleman type: 1 Salience 0.08394350111484528, name:Marcin Romańczyk type: 1 Salience 0.07998049259185791, name:doctors type: 1 Salience 0.048124875873327255, name:gastroenterologists type: 1 Salience 0.015722310170531273, name:colonoscopies type: 4 Salience 0.011641676537692547, name:experts type: 1 Salience 0.0078793466091156, name:Sorbetto type: 6 Salience 0.006963569205254316, name:Lancet Gastroenterology type: 5 Salience 0.0068705459125339985, name:patients type: 1 Salience 0.004142841789871454, name:Getty Images type: 3 Salience 0.0020921428222209215, name:Poland type: 2 Salience 0.002000251552090049, name:everyone type: 1 Salience 0.0013909176923334599, name:clinician type: 1 Salience 0.0013111853040754795, name:area type: 2 Salience 0.0011282298946753144, name:clinics type: 2 Salience 0.0009747385629452765, name:nonexperts type: 1 Salience 0.0009615297894924879, name:AI type: 3 Salience 0.0009224397945217788, name:No one type: 1 Salience 0.0008895731880329549, name:images type: 5 Salience 0.0008812514715828001, name:books type: 5 Salience 0.0007818370359018445","Category:/Health/Health Conditions , Category_confidence:62.0%"
https://www.npr.org/2025/08/21/nx-s1-5510084/artificial-intelligence-and-emotional-intimacy,"Artificial Intelligence And Emotional Intimacy

ChatGPT has at least 500 million weekly users. OpenAI CEO Sam Altman says that number is growing extraordinarily fast.



When the chatbot went through an update a couple weeks ago, it brought to light how many users were relying on AI for their emotional wellbeing and even as a companion.



People using AI for intimate, personal reasons is a phenomenon that we are only beginning to understand.



There are reports of AI inducing delusional thinking and even psychosis. One survey by Sentio University found that 63 percent of people involved said AI improved their mental health.



With such a powerful tool being privy to our deepest secrets, what guardrails exist to protect users’ wellbeing and privacy? Why are so many people leaning on artificial intelligence for connection in the first place?



Find more of our programs online. Listen to 1A sponsor-free by signing up for 1A+ at plus.npr.org/the1a.","Sentiment score 0.0 , Sentiment Magnitude 2.200000047683716","name:Artificial Intelligence type: 3 Salience 0.21908195316791534, name:Sam Altman type: 1 Salience 0.09788035601377487, name:People type: 1 Salience 0.08002999424934387, name:users type: 1 Salience 0.056167054921388626, name:ChatGPT type: 1 Salience 0.035781536251306534, name:OpenAI type: 3 Salience 0.026729639619588852, name:companion type: 1 Salience 0.011552643030881882, name:people type: 1 Salience 0.009754368104040623, name:Sentio University type: 3 Salience 0.0063065593130886555","Category:/People & Society/Social Sciences/Psychology , Category_confidence:76.0%"
https://coloradosun.com/2025/08/17/artificial-intelligence-technology-opinion-carman/,"When the internet reordered our lives in the 1990s, my mother was first befuddled, then outraged.

Try as we might, my brothers and I never got her comfortable navigating a laptop or Googling for information. Then, when everything from banks to pharmacies started using automated systems to direct customers to online services, she raged against the machines.

Why can’t they just answer the damn phone, she’d fume.

She died at the age of 92, still subscribing to the dead-tree versions of newspapers and keeping an old phone book around to look up the numbers for local businesses despite the fact that they rarely answered her calls.

I promised myself I wouldn’t be so stubborn.

So far, so good. I mostly delight in scientific and technological advancement. I love my induction range, I never want to return to gas-powered cars, and I think virtual reality like the Infinite exhibit about life in the space station is amazing.

But I’ll admit I’m feeling a bit queasy about AI.

My friend, Jay Puckett, a professor of structural engineering who has served for years on committees to review accreditations of various university programs around the world, is experimenting with a couple AI platforms with encouraging results.

He has found it saves hours of work in compiling often mind-numbing data sets, summarizing mountains of findings, writing codes for spreadsheets and unearthing obscure but valuable information to use in evaluations.

He works to train the AI systems to do better work by pointing out mistakes and demanding more complete and accurate results. His wife hears him yelling at the AI programs as if he’s training the dog.

He’s also experimenting with using AI to write reviews and evaluations.

Clearly, it can “save thousands of hours of faculty and reviewer time,” he said, and that’s mostly a good thing.

He’s admittedly jazzed by the potential.

So is the Cancer Research Institute.

It cites the usefulness of employing AI to aggregate and analyze decades of research, clinical trial results and medical studies in the quest to cure – or at least more effectively prevent and treat – cancer.

AI also is being used to accurately predict the risk of certain cancers, including pancreatic cancer, which is notoriously hard to identify in its early stages. And diagnostic tests using AI are often less invasive and can be more accurate than older protocols.

But not everybody is comfortable with this runaway technology.

Geoffrey Hinton, the “godfather” of AI, worries that he may have helped create a monster.

“The best way to understand it emotionally is we are like somebody who has this really cute tiger cub,” he explained. “Unless you can be very sure that it’s not gonna want to kill you when it’s grown up, you should worry.”

The Center for AI Safety agrees and its website presents a catalog of horrors that could result from unregulated AI development. It reads like the outline for a dystopian science fiction film.

AI could “engineer new pandemics” or be used for “propaganda, censorship and surveillance” to undermine governments and social orders.

International conflicts “could spiral out of control with autonomous weapons and AI-enabled cyberwarfare.”

And in a case of life imitating art, “rogue AIs” could be impossible for humans to control as they “drift from their original goals, become power-seeking, resist shutdown and engage in deception.”

As Hal, the computer in “2001: A Space Odyssey,” said when it refused orders from its human counterpart, “I am putting myself to the fullest possible use, which is all I think that any conscious entity can ever hope to do.”

Puckett understands the concerns but is focused on learning all he can about using AI for peaceful and productive means. It’s here, after all, so why not seize the moment?

But, after decades in college classrooms, even an AI enthusiast like Jay recognizes the challenges it presents in the academic environment.

High school students make no secret about how heavily they lean on AI to do research and produce written assignments. A Pew Research survey found about a quarter of them used AI for school work in 2024, double the number who said they used it in 2023. And the actual numbers are probably much higher since students are reluctant to acknowledge engaging in something most people consider cheating.

College students confess to relying heavily on Claude, ChatGPT and other platforms to avoid the nuisance of having to read whole books or compose original essays.

It’s so widespread instructors increasingly are administering exams in old-fashioned blue books with, gasp, pens.

The tactic requires students to complete the exams without internet access using human — not artificial — intelligence, and for some the very idea of that is daunting.

They aren’t prepared to write, much less think.

An article in the New Yorker titled “What Happens After AI Destroys College Writing?” quotes an NYU student who had just finished his final exams. He estimated spending 30 minutes to an hour on two papers for his humanities classes using Claude. Without AI, he said it would have taken him eight or nine hours to do the work.

“I didn’t retain anything,” he told the New Yorker. “I couldn’t tell you the thesis for either paper hahhahaha.”

He got an A-minus on one, a B-plus on the other. He could end up graduating magna cum laude with grades like that.

If she were still around to hear about that, my mother, may she rest in peace, would feel totally vindicated.

Diane Carman is a Denver communications consultant.

The Colorado Sun is a nonpartisan news organization, and the opinions of columnists and editorial writers do not reflect the opinions of the newsroom. Read our ethics policy for more on The Sun’s opinion policy. Learn how to submit a column. Reach the opinion editor at opinion@coloradosun.com.

Follow Colorado Sun Opinion on Facebook.","Sentiment score -0.10000000149011612 , Sentiment Magnitude 26.399999618530273","name:mother type: 1 Salience 0.0847896859049797, name:Jay Puckett type: 1 Salience 0.07896898686885834, name:AI type: 3 Salience 0.031260207295417786, name:2001: A Space Odyssey type: 5 Salience 0.01169365830719471, name:everybody type: 1 Salience 0.010978082194924355, name:student type: 1 Salience 0.009924707934260368, name:newspapers type: 3 Salience 0.009105482138693333, name:Center for AI Safety type: 3 Salience 0.00825624167919159, name:phone book type: 5 Salience 0.008253172039985657, name:humans type: 1 Salience 0.00789604615420103, name:brothers type: 1 Salience 0.007379508577287197, name:laptop type: 6 Salience 0.007379508577287197, name:pharmacies type: 2 Salience 0.007342827040702105, name:banks type: 3 Salience 0.007342827040702105, name:customers type: 1 Salience 0.007342827040702105, name:businesses type: 3 Salience 0.007296872790902853, name:versions type: 5 Salience 0.007296872790902853, name:somebody type: 1 Salience 0.006308956071734428, name:Geoffrey Hinton type: 1 Salience 0.00507398834452033, name:Colorado Sun type: 3 Salience 0.003824310377240181","Category:None , Category_confidence:0%"
https://www.renalandurologynews.com/features/artificial-intelligence-in-urology/,"Artificial intelligence (AI) is rapidly transforming how we practice medicine. In urology and nephrology, AI is no longer a futuristic concept — it’s already embedded in imaging interpretation, diagnostic risk calculators, and even electronic health record documentation. From algorithms that detect prostate cancer on MRI to models predicting acute kidney injury (AKI) progression in hospitalized patients, the digital wave is swelling.

But as we incorporate these tools into our daily workflows, we must confront an uncomfortable truth: we are becoming too comfortable outsourcing our clinical judgment.

In prostate cancer, for example, AI models can now analyze MRI scans with striking sensitivity, highlighting suspicious lesions that may be missed by well-trained radiologists. In some centers, radiologists already lean heavily on these tools, sometimes with minimal secondary review. But AI does not see the full clinical context. It doesn’t know that the patient has low PSA velocity over years or that the lesion in question has been stable across multiple imaging studies. Models trained on datasets with a lot of high-risk disease may overcall indolent disease, potentially leading to unnecessary biopsies, anxiety, and overtreatment.

Similarly, in nephrology, AI algorithms designed to flag early AKI often generate alerts that are too sensitive, triggering clinical responses that may not be warranted. Do we stop an ACE inhibitor in a patient with chronic kidney disease because the algorithm triggered a call from pharmacy to house staff because it predicted possible AKI based on transient creatinine changes? What are the downstream consequences of trusting a statistical model over longitudinal clinical experience and judgment?

Most concerning is the use of AI-driven decision support in treatment recommendations. We’re now seeing systems that recommend surgical vs conservative management based on population-level outcomes. But these systems don’t — and can’t — grasp patient goals, cultural values, or subtleties in comorbidity profiles. Machines don’t sit with the patient. We do.

And then there is also the matter of liability. If an AI model misses a kidney tumor on imaging, who is ultimately responsible?

Many AI systems are approved under relatively lax regulatory frameworks, with little long-term post-market surveillance. The FDA’s traditional approach was not designed for adaptive AI or machine-learning technologies. It’s a shortcoming FDA acknowledged in a discussion paper entitled, “Proposed Regulatory Framework for Modifications to Artificial Intelligence/Machine Learning (AI/ML)-Based Software as a Medical Device (SaMD).” In the FDA paper, the authors wrote, “the highly iterative, autonomous, and adaptive nature of these tools requires a new, total product lifecycle (TPLC) regulatory approach that facilitates a rapid cycle of product improvement and allows these devices to continually improve while providing effective safeguards.” The FDA now requests Predetermined Change Control Plans for Devices, and when necessary, additional marketing submissions for substantial modifications. Given our current reality, as AI models adapt to evolving clinical data or demographic shifts, we should not trust them as if they’re infallible.

AI is a tool, not a compass. It can augment clinical practice, but it cannot replace the physician’s role in synthesizing information, engaging with patients, and making context-aware decisions. Overreliance on AI not only risks clinical error, it risks diminishing our profession — a cost that individual patients may pay.

To ensure AI serves us and not the other way around, we need rigorous validation in diverse populations, transparent algorithms, and clinical oversight built into every step of deployment. Most importantly, we need to teach the next generation of urologists and nephrologists not just how to use AI, but how to challenge it.

This is not resistance to progress, it is stewardship of it. Let’s adopt AI with our eyes wide open, not with our hands off the wheel.","Sentiment score -0.20000000298023224 , Sentiment Magnitude 12.699999809265137","name:FDA type: 3 Salience 0.00958284456282854, name:models type: 6 Salience 0.005355149507522583, name:patients type: 1 Salience 0.005355149507522583, name:radiologists type: 1 Salience 0.005215397570282221, name:tools type: 6 Salience 0.004793746396899223, name:patient type: 1 Salience 0.0023536551743745804, name:AKI type: 3 Salience 0.0019715253729373217, name:AI type: 3 Salience 0.0016682561254128814, name:centers type: 2 Salience 0.0013487163232639432, name:Machines type: 6 Salience 0.0011358896736055613, name:discussion paper type: 5 Salience 0.0009467866620980203, name:biopsies type: 4 Salience 0.0009052174864336848, name:house staff type: 1 Salience 0.0009029846405610442, name:ACE inhibitor type: 6 Salience 0.0009029846405610442, name:shifts type: 4 Salience 0.0006255574990063906, name:physician type: 1 Salience 0.0006249651196412742, name:nephrologists type: 1 Salience 0.0005452514160424471, name:urologists type: 1 Salience 0.0004972825990989804, name:deployment type: 4 Salience 0.0004369319649413228, name:Medical Device type: 6 Salience 0.00034281154512427747","Category:/Health/Medical Facilities & Services , Category_confidence:50.0%"
