url,extracted_text,sentiment,entities,detailed_category
https://www.ncaa.com/news/football/article/2025-07-31/top-30-fbs-college-football-nonconference-games-season,"The 2025 college football season will be here in no time, so it's only right to highlight some of the best nonconference games in the FBS that you can't miss. These matchups could make or break your favorite team's season, either with College Football Playoff seeding or bragging rights.

Here are the top nonconference games for the 2025 season.

Week 1

Texas at Ohio State

Alabama at Florida State

LSU at Clemson

Nebraska vs. Cincinnati in Kansas City, Mo.

Syracuse vs. Tennessee in Atlanta

Virginia Tech vs. South Carolina in Atlanta

Georgia Tech at Colorado

Utah at UCLA

Notre Dame at Miami (Fla.)

TCU at North Carolina

Week 1 is full of nonconference games, and I have 10 here that you need to watch. The biggest game of them all is Texas at Ohio State. It’s a rematch of the College Football Playoff semifinals and it’ll most likely be a top-five matchup — if not top-two or three.

Alabama at Florida State has drawn plenty of hype thanks to new quarterback Tommy Castellanos’ trash talking this offseason. The trash talk has also reached Week 1 opponents LSU and Clemson as they battle over who’s the real “Death Valley” in an expected top-10 contest.

The Saturday slate will also see Coach Prime and Colorado without Shedeur Sanders and Travis Hunter for the first time. They’ll battle a Georgia Tech team led by a darkhorse preseason Heisman contender in Haynes King.

There’s a trio of neutral site contests to watch in Week 1 as Nebraska and Cincinnati play in the home of the Kansas City Chiefs. Syracuse and Tennessee (Saturday) and then Virginia Tech and South Carolina (Sunday) play in the home of the Atlanta Falcons.

Week 1 extends beyond Saturday as Notre Dame plays Miami on Sunday for the first time since 2017. This will likely be a ranked matchup as the CFP is the expectation in both South Bend and Coral Gables this fall. Monday closes the weekend as six-time Super Bowl winning head coach Bill Belichick makes his debut for North Carolina hosting TCU.

RANKINGS: See the latest college football rankings

Week 2

Michigan at Oklahoma

Arizona State at Mississippi State

Iowa at Iowa State

Baylor at SMU

A Big Ten-SEC matchup is always one to watch, especially when it's a pair of bluebloods with new quarterbacks like Michigan and Oklahoma. Elsewhere in the SEC, Mississippi State hosts Arizona State. If the Sun Devils can pick up a road SEC win, it’ll show they haven’t lost a step from their CFP run a year ago.

The last two nonconference games on this list are in-state battles as Iowa and Iowa State battle for the Cy-Hawk trophy and Baylor and SMU meet for the first time since 2016.

Week 3

Texas A&M at Notre Dame

Wisconsin at Alabama

Pitt at West Virginia

Florida Atlantic at FIU

Duke at Tulane

Week 3 features some big brands facing off like Texas A&M-Notre Dame and Wisconsin-Alabama, plus the Backyard Brawl. However, two games featuring American Conference schools catch my eye, too.

Florida Atlantic and FIU are a quick (pending traffic) trip up I-95 apart from one another in south Florida. The two programs are in different conferences, but share the same weather and recruiting base. The intensity between these in-state programs should be high.

I’ll call this last game the Darian Mensah Bowl. That’s the name of Duke’s new quarterback that transferred from Tulane this offseason. Can Mensah beat his old program, or will Tulane show Mensah what he missed out on?

PORTAL: College football transfers at every position that can have an instant impact in 2025

Week 4

Washington at Washington State

Oregon State at Oregon

SMU at TCU

Florida at Miami (FL)

James Madison at Liberty

The Apple Cup and Civil War are two rivalries that we almost missed out on because of conference realignment, but we get to see the schools play again in 2025. Another pair of in-state contests should also be intriguing as SMU plays TCU and Florida plays Miami.

James Madison at Liberty closes the Week 4 slate as the Dukes out of the Sun Belt and the Flames out of Conference USA could each win their conferences in 2025. That means this nonconference game could be the deciding factor as to which team receives the CFP automatic bid.

🗓️ SCHEDULE: Weekly FBS TV schedule and times | College Football Playoff schedule | Bowl schedule

Week 6

Boise State at Notre Dame

Notre Dame makes another appearance here thanks to its independent status making every game a nonconference game. Boise State comes to town in Week 6 to play the Fighting Irish, and it’ll be a matchup of two playoff teams from last year. Speaking of last year, Boise State pushed Oregon in a three-point defeat. The Broncos won’t be an easy win for Notre Dame.

Week 8

Southern California at Notre Dame

The USC-Notre Dame football rivalry is one of the most storied nonconference rivalries in sports. USC will enter the contest after what figures to be a tough home battle against Michigan, while Notre Dame enters after a home game against NC State. A loss from either team will dampen playoff hopes, so a lot is at stake here.

Week 14

Georgia at Georgia Tech

Clemson at South Carolina

Florida State at Florida

Kentucky at Louisville

Week 14 means rivalry week is here. Four matchups already catch my eye in the preseason. We saw an eight-overtime classic in 2024 between Georgia and Georgia Tech, and by the time these two programs meet in 2025, they both could have clinched conference title game berths.

The same goes for Clemson and South Carolina. Both teams were on the CFP bubble entering the game last year — and this year the Tigers and Gamecocks have their eyes on a playoff run yet again.

The final two games are ACC-SEC battles. Florida and Louisville are the two teams to watch here as both have displayed the talent to make a run at their respective conference titles. However, it’s rivalry week so anything can happen with emotions high.","Sentiment score 0.10000000149011612 , Sentiment Magnitude 16.700000762939453","name:Notre Dame type: 2 Salience 0.05721224844455719, name:rematch type: 4 Salience 0.04722665622830391, name:LSU type: 3 Salience 0.04332418367266655, name:matchup type: 4 Salience 0.03341672196984291, name:nonconference games type: 4 Salience 0.0293638426810503, name:Boise State type: 3 Salience 0.028085630387067795, name:TCU type: 3 Salience 0.02473066933453083, name:college football season type: 4 Salience 0.02326175570487976, name:Mississippi State type: 3 Salience 0.019185082986950874, name:Georgia Tech type: 3 Salience 0.017122581601142883, name:game type: 4 Salience 0.016560623422265053, name:South Carolina type: 2 Salience 0.016321983188390732, name:Clemson type: 2 Salience 0.015466006472706795, name:Ohio State type: 3 Salience 0.01197759062051773, name:Alabama type: 2 Salience 0.01197464857250452, name:team type: 3 Salience 0.011327894404530525, name:matchups type: 4 Salience 0.010855020023882389, name:Florida State type: 3 Salience 0.009567372500896454, name:Texas type: 2 Salience 0.009540374390780926, name:Darian Mensah Bowl type: 1 Salience 0.009339101612567902","Category:/Sports/College Sports , Category_confidence:97.0%"
https://www.inc.com/ben-sherry/how-this-founder-sold-his-vibe-coding-startup-for-80-million-just-4-months-after-launching-it/91225024,Failed to fetch page: 403,Failed to fetch page: 403,Failed to fetch page: 403,Failed to fetch page: 403
https://eig.org/dci-hub/,"The Distressed Communities Index (DCI) is a leading resource for understanding the geography of economic distress and opportunity in the United States. First launched by the Economic Innovation Group in 2015 and updated annually, this groundbreaking dataset offers a comprehensive view of local economic health across the country — empowering the work of researchers, policymakers, investors, and community leaders alike.

The DCI has earned wide recognition and trust, cited by The New York Times, The Wall Street Journal, The Washington Post, and hundreds of national and local media outlets. It has been used in influential academic research across disciplines, from economics and political science to public health and urban planning. Its insights have shaped legislation, guided philanthropic initiatives, and informed private sector business strategies.","Sentiment score 0.5 , Sentiment Magnitude 2.5","name:DCI type: 3 Salience 0.502357542514801, name:United States type: 2 Salience 0.013562033884227276, name:researchers type: 1 Salience 0.008586169220507145, name:policymakers type: 1 Salience 0.007546442095190287, name:investors type: 1 Salience 0.007546442095190287, name:community leaders type: 1 Salience 0.007546442095190287, name:country type: 2 Salience 0.007454569451510906, name:Economic Innovation Group type: 3 Salience 0.006535578519105911, name:The New York Times type: 3 Salience 0.004079694394022226, name:The Wall Street Journal type: 3 Salience 0.004079694394022226, name:legislation type: 5 Salience 0.0036181786563247442, name:media outlets type: 3 Salience 0.0022822837345302105, name:hundreds type: 1 Salience 0.0022822837345302105, name:The Washington Post type: 3 Salience 0.0013491022400557995","Category:/People & Society , Category_confidence:60.0%"
https://news.harvard.edu/gazette/story/2025/08/physicians-embrace-ai-note-taking-technology/,"AI-driven scribes that record patient visits and draft clinical notes for physician review led to significant reductions in physician burnout and improvements in well-being, according to a Mass General Brigham study of two large healthcare systems.

The findings, published in JAMA Network Open, draw on surveys of more than 1,400 physicians and advanced practice providers at both Harvard-affiliated Mass General Brigham and Atlanta’s Emory Healthcare.

At MGB, use of ambient documentation technologies was associated with a 21.2 percent absolute reduction in burnout prevalence at 84 days, while Emory Healthcare saw a 30.7 percent absolute increase in documentation-related well-being at 60 days.

50% Physician burnout linked to maintaining electronic patient files

“Ambient documentation technology has been truly transformative in freeing up physicians from their keyboards to have more face-to-face interaction with their patients,” said study co-senior author Rebecca Mishuris, chief medical information officer at MGB, a faculty member at Harvard Medical School, and a primary care physician in the healthcare system. “Our physicians tell us that they have their nights and weekends back and have rediscovered their joy of practicing medicine. There is literally no other intervention in our field that impacts burnout to this extent.”

Physician burnout affects more than 50 percent of U.S. doctors and has been linked to time spent in electronic health records, particularly after hours. There is additional evidence that the burden and anticipation of needing to complete their appointment notes also contributes significantly to physician burnout.

“Burnout adversely impacts both providers and their patients who face greater risks to their safety and access to care,” said Lisa Rotenstein, a co-senior study author and director of The Center for Physician Experience and Practice Excellence at Brigham and Women’s Hospital. She is also an assistant clinical professor of medicine at the UCSF School of Medicine. “This is an issue that hospitals nationwide are looking to tackle, and ambient documentation provides a scalable technology worth further study.”

“Our physicians tell us that they have their nights and weekends back and have rediscovered their joy of practicing medicine.” Rebecca Mishuris, Mass General Brigham



Qualitative feedback from users touted that ambient documentation enabled more “contact with patients and families,” improvements in their “joy in practice,” while recognizing its potential to “fundamentally [change] the experience of being a physician.” However, some users felt it added time to their note-writing or had less utility for certain visit types or medical specialties. Since the pilot studies began, the AI technologies have evolved as the vendors make changes based on user feedback and the large language models that power the technologies improve themselves through additional training, warranting continued study.

The researchers analyzed survey data from pilot users of ambient documentation technologies at two large health systems. At Mass General Brigham, 873 physicians and advanced practice providers were given surveys before enrolling, then after 42 and 84 days. About 30 percent of users responded to the surveys at 42 days, and 22 percent at 84 days. All 557 Emory pilot users were surveyed before the pilots and then at 60 days of use, with an 11 percent response rate. Researchers analyzed the survey results quantifying different measures of burnout at Mass General Brigham and physician well-being at Emory Healthcare.

The study authors added that given that these were pilot users and there were limited survey response rates, the findings likely represent the experience of more enthusiastic users, and more research is needed to track clinical use of ambient documentation across a broader group of providers.

Mass General Brigham’s ambient documentation program launched in July 2023 as a proof-of-concept pilot study involving 18 physicians. By July 2024, the pilot, which tested two different ambient documentation technologies, expanded to more than 800 providers. As of April 2025, the technologies have been made available to all Mass General Brigham physicians, with more than 3,000 providers routinely using the tools. Later this year, the program will look to expand to other healthcare professionals such as nurses, physical and occupational therapists, and speech-language pathologists.

“Ambient documentation technology offers a step forward in healthcare and new tools that may positively impact our clinical teams,” said Jacqueline You, lead study author and a digital clinical lead and primary care associate physician at Mass General Brigham. “While stories of providers being able to call more patients or go home and play with their kids without having to worry about notes are powerful, we feel the burnout data speak similar volumes of the promise of these technologies, and importance of continuing to study them.”

Ambient documentation’s use will continue to be studied with surveys and other measures tracking burnout rates and time spent on clinical notes inside and outside of working hours. Researchers will evaluate whether burnout rates improve over time as the AI evolves, or if these burnout gains plateau or are reversed.

This project received financial support from the Physician’s Foundation and the National Library of Medicine of the National Institutes of Health.","Sentiment score 0.10000000149011612 , Sentiment Magnitude 8.699999809265137","name:Mass General type: 1 Salience 0.0886940211057663, name:physicians type: 1 Salience 0.05763731151819229, name:Mass General Brigham type: 3 Salience 0.04521771892905235, name:patients type: 1 Salience 0.03345123678445816, name:scribes type: 1 Salience 0.029793022200465202, name:practice providers type: 1 Salience 0.017791634425520897, name:patient visits type: 4 Salience 0.014416862279176712, name:Lisa Rotenstein type: 1 Salience 0.01415675226598978, name:intervention type: 4 Salience 0.008964977227151394, name:reduction type: 4 Salience 0.00779963843524456, name:users type: 1 Salience 0.007164395414292812, name:providers type: 3 Salience 0.006855171173810959, name:Rebecca Mishuris type: 1 Salience 0.006580944638699293, name:primary care physician type: 1 Salience 0.005295599345117807, name:Harvard type: 3 Salience 0.004636551719158888, name:Emory Healthcare type: 3 Salience 0.0044448114931583405, name:Atlanta type: 2 Salience 0.00407287897542119, name:language models type: 6 Salience 0.004062293097376823, name:vendors type: 3 Salience 0.004062293097376823, name:physician type: 1 Salience 0.0035687333438545465","Category:/Health/Medical Facilities & Services , Category_confidence:71.0%"
https://www.ohio.edu/news/2025/08/stacy-strauss-depart-ohios-innovation-center,"The Ohio University Research Division has announced that Stacy Strauss, director of the Innovation Center in Athens, will be departing her role. Her last day will be Sept. 2, 2025.

Strauss has served as the director of the Innovation Center since 2016 and has worked with the center since 2014. During her tenure with the Innovation Center, Strauss has made significant contributions to supporting entrepreneurship, innovation and regional economic development.

“We thank and appreciate Stacy for her years of service to Ohio University and for all she accomplished as the director of the Innovation Center,” said Vice President for Research and Creative Activity Eric Muth.

Under Strauss's leadership, the Ohio University Innovation Center received national recognition for its work supporting new and small businesses and promoting economic development. The Innovation Center has received numerous awards for its work in recent years, including being named the International Incubator of the Year in 2019 and the No. 1 Rural Incubator in 2016, 2019 and 2022. Strauss first joined Ohio University in 2000 and served as the Head Soccer Coach from 2000 – 2013, winning two regular season Mid-American Conference Championships.

The Innovation Center supports its clients with a considerable range of resources via virtual or onsite client membership, which includes executive coaching, professional office space, laboratories, conference and meeting spaces, discounted vendor contracts, and access to an expansive network of public and private business industry experts.

“It has been an immense pleasure to support our region’s brave, bold, and determined founders and small businesses and to align partners toward successful economic development through the support of entrepreneurship,” Strauss said.

Questions about the Innovation Center may be directed to Interim Associate Vice President for Research Partnerships Jason Jolley at jolleyg1@ohio.edu.","Sentiment score 0.30000001192092896 , Sentiment Magnitude 4.599999904632568","name:Innovation Center type: 2 Salience 0.2733152210712433, name:Stacy Strauss type: 1 Salience 0.23084110021591187, name:Strauss type: 1 Salience 0.09056036919355392, name:director type: 1 Salience 0.06637111306190491, name:Ohio University Research Division type: 3 Salience 0.029821444302797318, name:Athens type: 2 Salience 0.02679876610636711, name:center type: 2 Salience 0.01377017330378294, name:businesses type: 3 Salience 0.00696989893913269, name:Jason Jolley type: 1 Salience 0.006026154849678278, name:Vice President for Research type: 1 Salience 0.0058472477830946445, name:International Incubator of the Year type: 1 Salience 0.004799124784767628, name:business industry experts type: 1 Salience 0.0038436593022197485, name:region type: 2 Salience 0.003838682547211647, name:founders type: 1 Salience 0.003838682547211647, name:No. 1 Rural Incubator type: 2 Salience 0.0036617042496800423, name:Head Soccer Coach type: 1 Salience 0.0034376580733805895, name:Creative Activity Eric Muth type: 1 Salience 0.0032697152346372604, name:partners type: 3 Salience 0.003059039358049631, name:office space type: 2 Salience 0.0019190018065273762, name:conference type: 4 Salience 0.0019190018065273762","Category:/Jobs & Education/Education/Colleges & Universities , Category_confidence:89.0%"
https://www.reuters.com/business/blockchain-lender-figure-technology-reveals-revenue-surge-us-ipo-filing-2025-08-18/,Failed to fetch page: 401,Failed to fetch page: 401,Failed to fetch page: 401,Failed to fetch page: 401
https://www.reuters.com/world/china/chinese-ai-startup-deepseek-releases-upgraded-model-with-domestic-chip-support-2025-08-21/,Failed to fetch page: 401,Failed to fetch page: 401,Failed to fetch page: 401,Failed to fetch page: 401
https://www.energy.gov/em/articles/modern-technology-offers-new-look-inside-hanfords-sealed-nuclear-reactors,"RICHLAND, Wash. — Workers at the U.S. Department of Energy Office of Environmental Management (EM) Hanford Field Office (HFO) used new imaging technology to inspect the Hanford Site’s decommissioned nuclear reactors, revealing a detailed look inside the sealed enclosures.

Putting this new technology to use at Hanford is part of EM's commitment to innovation and efficiency, focusing on priorities and reining in costs without sacrificing safety or effectiveness — all to deliver more to the American taxpayer.","Sentiment score 0.30000001192092896 , Sentiment Magnitude 0.8999999761581421","name:Wash type: 2 Salience 0.15632931888103485, name:RICHLAND type: 2 Salience 0.15632931888103485, name:Workers type: 1 Salience 0.1277683526277542, name:U.S. Department of Energy Office of Environmental Management type: 3 Salience 0.07643652707338333, name:Hanford Field Office type: 3 Salience 0.053405437618494034, name:Hanford Site type: 2 Salience 0.031021688133478165, name:reactors type: 2 Salience 0.030214542523026466, name:taxpayer type: 1 Salience 0.016293993219733238, name:American type: 2 Salience 0.009640458039939404","Category:/Business & Industrial , Category_confidence:77.0%"
https://www.ey.com/en_us,"Will you shape the future or be shaped by it?

We believe the best way to predict the future is to create it. And that takes confidence. The confidence to ask better questions and act on those answers, the confidence to empower your workforce, the confidence to transform, innovate and change. Find out how we’re committed to helping the world’s organizations achieve this.","Sentiment score 0.30000001192092896 , Sentiment Magnitude 1.899999976158142","name:organizations type: 3 Salience 0.02591128647327423, name:world type: 2 Salience 0.02591128647327423","Category:/People & Society , Category_confidence:52.0%"
https://www.psu.edu/news/agricultural-sciences/story/penn-states-2025-ag-progress-days-success-showcasing-innovation-impact,"UNIVERSITY PARK, Pa. — Penn State’s Ag Progress Days, held Aug. 12-14 at the Russell E. Larson Agricultural Research Center at Rock Springs, was a successful showcase of agricultural innovation, research and technology, according to leaders in the College of Agricultural Sciences, which sponsored the event.

Over its three-day run, the annual expo attracted an estimated 42,000 visitors from throughout Pennsylvania and beyond — including agricultural producers and industry representatives, government officials, consumers and families, home gardeners, environmental advocates, horse enthusiasts, and others.

Attendees perused more than 430 commercial and educational exhibits, took tours of the research center, watched farm safety and field machinery demonstrations, took in presentations and workshops, learned about foods and healthy living, participated in hands-on activities for youth, and enjoyed other activities.

By highlighting research involving emerging and advanced technologies — and the educational programs that translate the science for producers, students, communities and consumers — the college was able to demonstrate the return Pennsylvania receives on its investment in agricultural research and extension, noted Troy Ott, dean of the College of Agricultural Sciences.

“As Pennsylvania’s only land-grant university, we serve agriculture by developing science-based solutions, technological innovations, and a highly trained workforce to address the challenges and capture the opportunities that will drive economic prosperity in the commonwealth,” Ott said. “At Ag Progress Days, we were able to give producers, policymakers and the public a glimpse of how their land-grant university is using the resources entrusted to us to advance and deploy these technologies and find solutions to the challenges we face.”","Sentiment score 0.30000001192092896 , Sentiment Magnitude 2.5999999046325684","name:producers type: 1 Salience 0.09878567606210709, name:College of Agricultural Sciences type: 3 Salience 0.08160008490085602, name:Pa type: 2 Salience 0.03478529676795006, name:UNIVERSITY PARK type: 2 Salience 0.03478529676795006, name:showcase type: 4 Salience 0.030808545649051666, name:expo type: 4 Salience 0.027196884155273438, name:Russell E. Larson Agricultural Research Center type: 2 Salience 0.01907994970679283, name:Troy Ott type: 1 Salience 0.017619146034121513, name:Penn State type: 3 Salience 0.01676841825246811, name:Rock Springs type: 2 Salience 0.01676841825246811, name:event type: 4 Salience 0.012002859264612198, name:leaders type: 1 Salience 0.010747477412223816, name:visitors type: 1 Salience 0.010694109834730625, name:run type: 4 Salience 0.010694109834730625, name:research center type: 2 Salience 0.008288690820336342, name:workshops type: 4 Salience 0.008288690820336342, name:consumers type: 1 Salience 0.008216463960707188, name:communities type: 1 Salience 0.007584711536765099, name:machinery demonstrations type: 4 Salience 0.007281561382114887, name:youth type: 1 Salience 0.007281561382114887","Category:/Jobs & Education/Education/Colleges & Universities , Category_confidence:74.0%"
